[
    {
        "tags": [
            "Django"
        ],
        "corpus": "\u7f16\u7a0b\u6742\u8bb0",
        "summary": "\n      \n      \n\u81ea\u5b9a\u4e49Django\u540e\u53f0\u540d\u79f0\n2017-09-03\n2018-02-10\nDjango\n\u7f16\u7a0b\u6742\u8bb0\nDjango-Admin-Name\n\n\n\u81ea\u5b9a\u4e49Django\u540e\u53f0\u540d\u79f0\n\n\u4f17\u6240\u5468\u77e5\uff0cDjango\u9ed8\u8ba4\u7684\u540e\u53f0\u662f\u82f1\u6587\u3002\u5728\u4fee\u6539\u4e86Settings\u4e4b\u540e\uff0cDjango\u81ea\u5e26\u7684user\u6539\u6210\u4e86\u4e2d\u6587\uff0c\u81ea\u5df1\u5199\u7684App\u5bf9\u5e94\u7684\u4f9d\u65e7\u662f\u82f1\u6587\u3002\n\u4e8e\u662f\u82b1\u4e86\u4e00\u4e9b\u65f6\u95f4\u6765\u67e5\u548b\u6539\u540d\u5b57\u3002\u6bd5\u7adf\u4e2d\u56fd\u4eba\u66f4\u9002\u5e94\u4e2d\u6587\u3002\n\u4fee\u6539App\u540d\u79f0\n\n\u5bf9\u5e94\u7684App\u76ee\u5f55\u4e0b\u7684apps.py\u6587\u4ef6\u91cc\u6709Django\u81ea\u52a8\u751f\u6210\u7684AppNameConfig\u7c7b  (\u5982\u679c\u6ca1\u6709\uff0c\u8bf4\u660e\u8fd9\u4e2aApp\u4e0d\u662fmanage.py startapp AppName\u547d\u4ee4\u751f\u6210\u7684)\u3002\n\u4e00\u822c\u8fd9\u4e2a\u7c7b\u91cc\u53ea\u6709\u9ed8\u8ba4\u7684\u4e00\u4e2a\u5c5e\u6027name\uff0c\u6211\u4eec\u81ea\u5df1\u589e\u52a0\u4e24\u6761\u5c5e\u6027\nclass AppNameConfig(AppConfig):\n    name = 'appname'\n    verbose_name = u\"\u5e94\u7528\u540d\u79f0\"\n    verbose_name_plural = u\"\u5e94\u7528\u540d\u79f0\"\n\n\u7136\u540e\u5728\u5bf9\u5e94\u7684App\u76ee\u5f55\u4e0b__init__.py\u6587\u4ef6\u91cc\u589e\u52a0\u4e00\u6761\u8bed\u53e5\ndefault_app_config = 'AppName.apps.AppNameConfig'\n\n\u4fee\u6539Model\u540d\u79f0\n\n\u5728\u81ea\u5df1\u5b9a\u4e49\u7684model\u7c7b\u91cc\u9762\u589e\u52a0class Meta\u7136\u540e\u91cd\u542f\u670d\u52a1\u5668\u5373\u53ef\nclass Example(models.Model):\n    # other statements\n    class Meta:\n        verbose_name = u\"\u6a21\u5757\u540d\u79f0\"\n        verbose_name_plural = u\"\u6a21\u5757\u540d\u79f0\"\n\n\u4fee\u6539Model\u5185\u5b57\u6bb5\u540d\u79f0\n\n\u8fd9\u51e0\u4e4e\u662f\u6240\u6709Django\u6559\u7a0b\u91cc\u90fd\u4f1a\u63d0\u5230\u7684\uff0c\u5b9a\u4e49\u65f6\u589e\u52a0verbose_name\u53c2\u6570\u5373\u53ef\nclass Example(models.Model):\n    Name = models.CharField(verbose_name=\"\u59d3\u540d\", max_length=20)\n\n\u4fee\u6539\u9ed8\u8ba4\u7684Django\u6807\u9898\n\nDjango\u81ea\u5e26\u7684\u540e\u53f0\u9875\u9762\u5de6\u4e0a\u89d2\u7855\u5927\u7684Django\u5b57\u6837\u548c\u9875\u9762\u6807\u9898\uff0c\u8fd8\u6709\u540e\u53f0\u9996\u9875\u7684\u6807\u9898\u90fd\u53ef\u4ee5\u5f88\u5bb9\u6613\u7684\u8fdb\u884c\u4fee\u6539\u3002\u53ea\u9700\u8981\u5728\u4efb\u4f55\u4e00\u4e2a\u5bfc\u5165\u4e86django.admin\u6a21\u5757\u7684\u6587\u4ef6(\u6211\u4e00\u822c\u9009\u62e9\u9879\u76ee\u7684\u603burls.py)\u91cc\u5199\u5165\nadmin.site.site_header = '\u6211\u5728\u5de6\u4e0a\u89d2'\nadmin.site.site_title = '\u6211\u5728\u6d4f\u89c8\u5668\u6807\u7b7e'\nadmin.site.index_title = '\u6211\u5728\u540e\u53f0\u9996\u9875'\n\n\n\u6316\u4e2a\u5751\uff0c\u7b49suitV2\u6587\u6863\u5199\u597d\uff0c\u51c6\u5907\u5199\u4e00\u7bc7\u4f7f\u7528suitV2\u6765\u7f8e\u5316\u540e\u53f0\u7684\u3002\n\n      \n      \n\u81ea\u5b9a\u4e49Django\u540e\u53f0\u540d\u79f0\n\n\u4fee\u6539App\u540d\u79f0\n\u4fee\u6539Model\u540d\u79f0\n\u4fee\u6539Model\u5185\u5b57\u6bb5\u540d\u79f0\n\u4fee\u6539\u9ed8\u8ba4\u7684Django\u6807\u9898\n\n\n\n\n      \u2261\n    ",
        "permalink": "Django-Admin-Name",
        "update": "2018-02-10",
        "title": "\u81ea\u5b9a\u4e49Django\u540e\u53f0\u540d\u79f0",
        "date": "2017-09-03"
    }
]